{
  "schema_version": "octon-mini.source.legacy-reference-allowlist.v1",
  "document_role": "exact_legacy_reference_exception_inventory",
  "permission_grant": false,
  "token_class": "mixed_legacy_identity",
  "legacy_pattern": "Project Blueprint|\\bBlueprint\\b|project-blueprint|project_bootstrap|(?<!octon-mini-)project-bootstrap|blueprint_(?:version|implementation_asset)|BLUEPRINT_VERSION|blueprint:|(?<![A-Za-z0-9_])pb(?:_[A-Za-z0-9_]+|\\.py)?(?![A-Za-z0-9_])|pbv-",
  "classification_policies": {
    "truthful_historical_record": {
      "reason": "The file preserves accepted source history, release history, or evidence provenance under the identity that existed when it was recorded.",
      "retirement_condition": "Retain while the historical record remains authoritative; narrow the entry if those exact passages move."
    },
    "closed_historical_fixture": {
      "reason": "The closed historical artifact preserves its original data model and vocabulary without creating current runtime compatibility.",
      "retirement_condition": "Retain only while the closed historical migration remains supported and truthful."
    },
    "explicit_legacy_migration_input": {
      "reason": "The current source recognizes the legacy value only as inert migration input, historical provenance, or a negative assertion; it never dispatches the legacy runtime.",
      "retirement_condition": "Remove when the explicit cross-brand migration-input reader and provenance support are retired."
    },
    "breaking_transition_explanation": {
      "reason": "The current document names the retired identity only to explain the deliberate breaking transition to Octon Mini.",
      "retirement_condition": "Remove when the breaking-transition explanation or cross-brand migration is retired."
    }
  },
  "entries": [
    {"id": "LEGACY-0001", "path": "ARCHITECTURAL_PATTERN_INTEGRATION_REVIEW.md", "file_sha256": "257433c349dbb4bda027eefe3e57bec47ad393d5a41414fe1f2e041a935a35f1", "classification": "truthful_historical_record", "occurrence_count": 86},
    {"id": "LEGACY-0002", "path": "ARCHITECTURE_DECISIONS.md", "file_sha256": "a2afa38972edf94140b430355bc18b9e8e9631cab34d5e200c6230c2ab7c1ace", "classification": "truthful_historical_record", "occurrence_count": 13},
    {"id": "LEGACY-0003", "path": "CHANGELOG.md", "file_sha256": "d76f347f1e9fdb2b2928f454761ff3b4c0048d413d1faafd808939bb6cbe8b2f", "classification": "truthful_historical_record", "occurrence_count": 10},
    {"id": "LEGACY-0004", "path": "GIT_WORKFLOW.md", "file_sha256": "49f2220f1169eda7f4d50debafd09447fe5e99baaaa536584b127f28eb681da2", "classification": "breaking_transition_explanation", "occurrence_count": 1},
    {"id": "LEGACY-0005", "path": "README.md", "file_sha256": "52647b0bb8505adf5fee039ef9abda2199260fec619a087ea1280971e9ed823f", "classification": "breaking_transition_explanation", "occurrence_count": 3},
    {"id": "LEGACY-0006", "path": "RELEASE.md", "file_sha256": "3beefd659e2b8ea18c6af4509c80b39faa6aa095ef201ae255b4d14cc2adf4b0", "classification": "truthful_historical_record", "occurrence_count": 7},
    {"id": "LEGACY-0007", "path": "docs/COMPATIBILITY.md", "file_sha256": "4299312bee6a365f5347946a347a23ef637dac9428fed789c24e067f666ad72d", "classification": "breaking_transition_explanation", "occurrence_count": 10},
    {"id": "LEGACY-0008", "path": "docs/GOLDEN_PATHS.md", "file_sha256": "709c6888ad6cb4a9b309cda084a28ed39e7a732b30c69dc6ef0a00dfd8fa0e1b", "classification": "breaking_transition_explanation", "occurrence_count": 2},
    {"id": "LEGACY-0009", "path": "docs/GUIDED_SETUP.md", "file_sha256": "558ab25fa2ff8b1c6c9f4ddab2ca4ac88774aaad60d89f1c56444c8e9ab92b49", "classification": "breaking_transition_explanation", "occurrence_count": 3},
    {"id": "LEGACY-0010", "path": "migrations/1.0.0-to-1.0.1.md", "file_sha256": "ef940e7eae274f0a974b61192260ff4e75236dc10b42a90b48cc30c4db9153c5", "classification": "closed_historical_fixture", "occurrence_count": 2},
    {"id": "LEGACY-0011", "path": "migrations/1.0.1-to-2.0.0.md", "file_sha256": "8e9a7befa80aa9b805e502c8534112f688e02366aced320d4765d71db0020362", "classification": "closed_historical_fixture", "occurrence_count": 4},
    {"id": "LEGACY-0012", "path": "migrations/2.0.0-to-3.0.0.md", "file_sha256": "effa51c912a601314077d195247af0bb8b4780d7eb455405f10875293ba15edc", "classification": "closed_historical_fixture", "occurrence_count": 4},
    {"id": "LEGACY-0013", "path": "migrations/3.0.0-to-3.1.0.md", "file_sha256": "c94dbea76e867c09d9b7999f9ae9e88663dfc94939f1eecedcf2184b995b22b1", "classification": "closed_historical_fixture", "occurrence_count": 4},
    {"id": "LEGACY-0014", "path": "migrations/3.1.0-to-4.0.0.md", "file_sha256": "75e5cf038a999646c3b35fd8474da1a37c1a34a216201a76f39b3175c4e08e33", "classification": "breaking_transition_explanation", "occurrence_count": 20},
    {"id": "LEGACY-0015", "path": "patterns/records/PAT-0001-lifecycle-disposition.json", "file_sha256": "7acc8f30e1a46dc26e0b3402af56d33631484c90e5a5f8bbb29229e44dbd7360", "classification": "truthful_historical_record", "occurrence_count": 2},
    {"id": "LEGACY-0016", "path": "patterns/records/PAT-0002-governed-change-and-effects.json", "file_sha256": "054fe80bc7d385f8b8683c778f5e9f0d9048bfc2f8e33f3384e2e66698491a81", "classification": "truthful_historical_record", "occurrence_count": 2},
    {"id": "LEGACY-0017", "path": "patterns/records/PAT-0003-architecture-proof.json", "file_sha256": "fedb4fa357d74c0cb3bc08d04cb448e9e740833207cba53e0432592995145a49", "classification": "truthful_historical_record", "occurrence_count": 2},
    {"id": "LEGACY-0018", "path": "shared/GENERATION_CONTRACT.md", "file_sha256": "7c8a4abc550fabe77707187ca5e6f32d7b8ffc55c0a036d49e3f38530a5c8a29", "classification": "breaking_transition_explanation", "occurrence_count": 7},
    {"id": "LEGACY-0019", "path": "shared/schemas/octon-mini-bootstrap-migration-seed.schema.json", "file_sha256": "e24d728154fec0604b839979097ad3295010afc54eb2ab2a07e42304fef4b733", "classification": "explicit_legacy_migration_input", "occurrence_count": 12},
    {"id": "LEGACY-0020", "path": "shared/schemas/octon-mini-bootstrap-upgrade.schema.json", "file_sha256": "8d49fd50503dff160766844759a9f8fc7adcd54373f7bbc040a5f76acf5c3a70", "classification": "explicit_legacy_migration_input", "occurrence_count": 1},
    {"id": "LEGACY-0021", "path": "shared/schemas/octon-mini-project-origin.schema.json", "file_sha256": "0cecee45a69e3e1c9175d41078941f54802929a674c55973ee4ae5d79bc6ac85", "classification": "explicit_legacy_migration_input", "occurrence_count": 4},
    {"id": "LEGACY-0022", "path": "skills/octon-mini-project-bootstrap/fixtures/migrations/1.0.1-to-2.0.0/README.md", "file_sha256": "24af01954297706f24b1e8500b50377a82db3ac9af3efb213f41808337d9c8e0", "classification": "closed_historical_fixture", "occurrence_count": 4},
    {"id": "LEGACY-0023", "path": "skills/octon-mini-project-bootstrap/fixtures/migrations/1.0.1-to-2.0.0/invalid/adopted-without-v2-evidence.json", "file_sha256": "33d06bf24ec7e2d30b89d989c3b3d001e355a8ed11cc7f6ede99ef4db6595964", "classification": "closed_historical_fixture", "occurrence_count": 1},
    {"id": "LEGACY-0024", "path": "skills/octon-mini-project-bootstrap/fixtures/migrations/1.0.1-to-2.0.0/invalid/ambiguous-dependency.json", "file_sha256": "7f6a932c8dd35219b888e56fd251441cf1b791e2d84147bdc32257f9a664883c", "classification": "closed_historical_fixture", "occurrence_count": 1},
    {"id": "LEGACY-0025", "path": "skills/octon-mini-project-bootstrap/fixtures/migrations/1.0.1-to-2.0.0/invalid/configured-legacy-command.json", "file_sha256": "2ae7873ae6f176f2e916becb41abb6b60eb3360aa374c2d201b654abd9fd9891", "classification": "closed_historical_fixture", "occurrence_count": 1},
    {"id": "LEGACY-0026", "path": "skills/octon-mini-project-bootstrap/fixtures/migrations/1.0.1-to-2.0.0/invalid/hard-advisory-confusion.json", "file_sha256": "773f71e19531396fc66e3f07287d4f5cff752cfb5116a74befb2c6d5ebaa85fa", "classification": "closed_historical_fixture", "occurrence_count": 1},
    {"id": "LEGACY-0027", "path": "skills/octon-mini-project-bootstrap/fixtures/migrations/1.0.1-to-2.0.0/invalid/legacy-blocked-direct-to-execution.json", "file_sha256": "f221d27e2263f2fd822ea13193147eb76ef6b673a229595439dd7ec598b6f5b8", "classification": "closed_historical_fixture", "occurrence_count": 1},
    {"id": "LEGACY-0028", "path": "skills/octon-mini-project-bootstrap/fixtures/migrations/1.0.1-to-2.0.0/invalid/mismatched-version-executable.json", "file_sha256": "81769a5066c062edfed6c6690cae3c778e4a3511e62c9f52e088f9d1146ad75b", "classification": "closed_historical_fixture", "occurrence_count": 1},
    {"id": "LEGACY-0029", "path": "skills/octon-mini-project-bootstrap/fixtures/migrations/1.0.1-to-2.0.0/invalid/mixed-live-authority.json", "file_sha256": "82b8097a77c9057bc159ea0923a22113792bb03b3a1dc8ade81eefeeccf00be3", "classification": "closed_historical_fixture", "occurrence_count": 2},
    {"id": "LEGACY-0030", "path": "skills/octon-mini-project-bootstrap/fixtures/migrations/1.0.1-to-2.0.0/invalid/mixed-live-project-authority.json", "file_sha256": "01d582b4d70f1049c7188913228f9fd0c468743534a1aa8944ed2c2342aa623c", "classification": "closed_historical_fixture", "occurrence_count": 1},
    {"id": "LEGACY-0031", "path": "skills/octon-mini-project-bootstrap/fixtures/migrations/1.0.1-to-2.0.0/invalid/mixed-live-validator-authority.json", "file_sha256": "f0961146d3e471159ddb9b6361b99d1bb48e28f1ba0e4dcd12127dea73c62992", "classification": "closed_historical_fixture", "occurrence_count": 1},
    {"id": "LEGACY-0032", "path": "skills/octon-mini-project-bootstrap/fixtures/migrations/1.0.1-to-2.0.0/invalid/nonexternal-migration-authority.json", "file_sha256": "1d4243aa806151c018c4bc81e8e3288e3b6c2aa9fec67b5f7e9255407fc3ab3e", "classification": "closed_historical_fixture", "occurrence_count": 1},